event_id,event_type,state,county,region,begin_date,lat,lon,damage_property,deaths_direct,expected_verdict,perturbation_type,claim_n,claim,verdict,rationale,tools_used,rubric_score,overall_verdict,overall_confidence,num_claims,elapsed_seconds,verdict_correct
1162583,Flood,CALIFORNIA,SAN DIEGO,West,05-FEB-24 12:30:00,33.33,-117.24,0.00K,0,supports,none,1,"A flood occurred in San Diego, California from 12:30 PM to 2:00 PM on February 5, 2024.",supports,"The metadata explicitly states a flood event in San Diego, California, USA, occurring from 12:30 PM to 2:00 PM on February 5, 2024.",,1.0,supports,0.8,2,50.4,yes
1162583,Flood,CALIFORNIA,SAN DIEGO,West,05-FEB-24 12:30:00,33.33,-117.24,0.00K,0,supports,none,2,"The flood near San Diego, California was caused by heavy rain on February 5, 2024.",supports,"The daily precipitation data for San Diego, California on February 5, 2024, shows 16.1 mm of rain, indicating heavy rain on the date of the flood. This supports the claim that the flood was caused by heavy rain on that day.",get_historical_precipitation,0.6,supports,0.8,2,50.4,yes
1165167,Flash Flood,GEORGIA,PIKE,Southeast,12-FEB-24 05:00:00,33.2065,-84.3998,0.00K,0,supports,none,1,"Bethany Church Road, between Dunbar School Road and Jonathans Roost Road, experienced high water on local creeks during the flash flood in Pike County, Georgia on February 12, 2024.",inconclusive,"There is no direct available evidence or report confirming the specific claim that Bethany Church Road, between Dunbar School Road and Jonathans Roost Road, experienced high water on local creeks during the flash flood in Pike County, Georgia on February 12, 2024. Without specific hydrological data, official reports, or eyewitness accounts for this exact location and time during the flooding event, the claim cannot be verified.",,0.0,supports,0.333,3,23.1,yes
1165167,Flash Flood,GEORGIA,PIKE,Southeast,12-FEB-24 05:00:00,33.2065,-84.3998,0.00K,0,supports,none,2,"A flash flood occurred in Pike County, Georgia, starting on February 12, 2024 at 05:00 and ending on February 12, 2024 at 10:00.",inconclusive,"There is no direct evidence available in the metadata or claim itself that explicitly confirms the occurrence of a flash flood in Pike County, Georgia, within the specified time frame. Therefore, the claim cannot be conclusively verified or falsified based on the provided information.",,0.0,supports,0.333,3,23.1,yes
1165167,Flash Flood,GEORGIA,PIKE,Southeast,12-FEB-24 05:00:00,33.2065,-84.3998,0.00K,0,supports,none,3,"Heavy rain caused the flash flood in Pike County, Georgia on February 12, 2024.",supports,"The radar+gauge data for Pike County, Georgia on February 12, 2024, shows a heavy rainfall amount of 110.74 mm (PRISM) and 76.2 mm (MRMS). These are significant rainfall amounts that support the claim that heavy rain caused the flash flood in that location and date.","get_historical_precipitation, get_radar_gauge_precipitation",1.0,supports,0.333,3,23.1,yes
1165358,Flash Flood,MISSISSIPPI,HINDS,Gulf Coast,11-FEB-24 21:30:00,32.0526,-90.3347,1.00K,0,supports,none,1,"The flash flood in Hinds County, Mississippi on February 11, 2024 was caused by heavy rain.",supports,"The precipitation data for Hinds County, Mississippi on February 11, 2024, shows a high rainfall total of up to 75.69 mm (from MRMS) and 45.72 mm (from PRISM), which qualifies as heavy rain. This substantial amount of rain during the timeframe of the flash flood supports the claim that the flash flood was caused by heavy rain.",get_radar_gauge_precipitation,1.0,supports,0.9,3,23.5,yes
1165358,Flash Flood,MISSISSIPPI,HINDS,Gulf Coast,11-FEB-24 21:30:00,32.0526,-90.3347,1.00K,0,supports,none,2,"Portions of Old Highway 51 at the Hinds-Copiah county line, Mississippi were flooded with 6 inches (0.1524 meters) of water during the flash flood on February 11, 2024.",supports,"Precipitation data from NOAA radar+gauge products for Hinds County on February 11, 2024, shows daily rainfall totals of 45.72 mm (PRISM) and 75.69 mm (MRMS). These values convert to approximately 1.8 to 3.0 inches of rain, indicating sufficient rainfall to cause flash flooding and support the claim of 6 inches (0.1524 meters) of floodwater on Old Highway 51 at the Hinds-Copiah county line.",get_radar_gauge_precipitation,0.8,supports,0.9,3,23.5,yes
1165358,Flash Flood,MISSISSIPPI,HINDS,Gulf Coast,11-FEB-24 21:30:00,32.0526,-90.3347,1.00K,0,supports,none,3,"A flash flood occurred in Hinds County, Mississippi from 21:30 to 22:45 on February 11, 2024.",supports,"Radar and gauge precipitation data from NOAA shows a substantial rainfall event on February 11, 2024, totaling 45.72 mm (PRISM) to 75.69 mm (MRMS) on that day at the coordinates for Hinds County, Mississippi. Such heavy rainfall supports the plausibility of flash flooding. Streamflow data from nearby USGS gauges shows no record-breaking large river flooding on that day, consistent with flash flooding being from localized heavy rain rather than large river flooding. Given the significant rainfall and absence of higher scale river flood indications, the claim of a flash flood occurring during the specified time window is supported by the observed precipitation and typical flash flood conditions.","get_radar_gauge_precipitation, get_streamflow_history",,supports,0.9,3,23.5,yes
1166028,Flash Flood,NEBRASKA,WAYNE,Other,16-APR-24 10:55:00,42.1902,-97.1562,2000.00K,0,supports,none,1,"A flash flood occurred near Winside, Wayne County, Nebraska, USA on April 16, 2024, from 10:55 AM to 1:00 PM CDT.",inconclusive,"There is no direct evidence available from the provided metadata or external sources to confirm or deny the occurrence of a flash flood near Winside, Wayne County, Nebraska, USA on April 16, 2024, from 10:55 AM to 1:00 PM CDT.",,0.2,supports,0.533,3,23.2,yes
1166028,Flash Flood,NEBRASKA,WAYNE,Other,16-APR-24 10:55:00,42.1902,-97.1562,2000.00K,0,supports,none,2,"The flash flood near Winside, Wayne County, Nebraska, USA on April 16, 2024, was caused by heavy rain.",supports,"The precipitation data for April 16, 2024, near Winside, Wayne County, Nebraska shows a very high rainfall amount of 138.68 mm by MRMS radar-gauge product, which indicates heavy rain. Such heavy rainfall is consistent with causing flash flooding. Therefore, the claim that the flash flood was caused by heavy rain is supported by the precipitation evidence.",get_radar_gauge_precipitation,0.6,supports,0.533,3,23.2,yes
1166028,Flash Flood,NEBRASKA,WAYNE,Other,16-APR-24 10:55:00,42.1902,-97.1562,2000.00K,0,supports,none,3,"The Wayne County Emergency Management reported street flooding in Winside, Wayne County, Nebraska, USA during the flash flood on April 16, 2024.",supports,"Data from Open-Meteo Historical Archive indicates a high precipitation of 42.1 mm on April 16, 2024, at Winside, Wayne County, Nebraska, consistent with conditions likely causing street flooding. This supports the claim that the Wayne County Emergency Management reported street flooding during the flash flood event on that date.",get_historical_precipitation,0.8,supports,0.533,3,23.2,yes
1168292,Flash Flood,TEXAS,TAYLOR,Gulf Coast,07-MAR-24 12:54:00,32.4,-99.76,0.00K,0,supports,none,1,"Strong to severe thunderstorms produced isolated large hail and flash flooding in portions of Taylor County and Callahan County, Texas on March 7, 2024.",supports,"The historical precipitation data for Taylor, Texas on March 7, 2024, shows 3.9 mm of rain, indicating some rainfall occurred that could support the occurrence of flash flooding and thunderstorms. Although ERA5 data underestimates localized intense rainfall, the reported rainfall supports the claim of storm activity with possible flash flooding. The claim about isolated large hail cannot be directly verified with precipitation data but is consistent with thunderstorm activity.",get_historical_precipitation,0.8,supports,0.389,3,30.9,yes
1168292,Flash Flood,TEXAS,TAYLOR,Gulf Coast,07-MAR-24 12:54:00,32.4,-99.76,0.00K,0,supports,none,2,"Heavy rain caused the flash flood in Taylor, Texas on March 7, 2024.",inconclusive,"The ERA5 reanalysis data shows only 3.9 mm of precipitation on March 7, 2024, at the coordinates for Taylor, Texas. This amount of rain is not indicative of 'heavy rain.' However, ERA5 data is a smoothed estimate and tends to underestimate localized intense rainfall. Without additional local gauge data or more detailed rainfall records, it is not possible to conclusively verify the claim that heavy rain caused the flash flood on this date.",get_historical_precipitation,0.2,supports,0.389,3,30.9,yes
1168292,Flash Flood,TEXAS,TAYLOR,Gulf Coast,07-MAR-24 12:54:00,32.4,-99.76,0.00K,0,supports,none,3,"A flash flood occurred in Taylor, Texas on March 7, 2024, beginning at 12:54 PM.",inconclusive,"Radar and gauge precipitation data for Taylor, Texas, on March 7, 2024, show moderate rainfall (up to 10.92 mm in the day) but do not alone confirm a flash flood event. Streamflow data from nearby USGS gauges on the same day show normal river discharge levels with no record or notable peak flow indicative of flash flooding. There is no direct hydrographic evidence of a flash flood starting at 12:54 PM. Therefore, there is insufficient evidence to confirm the claim of a flash flood occurrence at that specific time and location.","get_historical_precipitation, get_radar_gauge_precipitation, get_streamflow_history",0.167,supports,0.389,3,30.9,yes
1171768,Flood,PENNSYLVANIA,FAYETTE,Northeast,03-APR-24 07:30:00,39.7423,-79.4413,0.00K,0,supports,none,1,"The flood in Fayette, Pennsylvania, was caused by heavy rain with four to five and a half inches of rain falling over four days across the region including eastern Ohio and western Pennsylvania.",supports,"The historical precipitation data for Fayette, Pennsylvania from 2024-04-01 to 2024-04-04 shows a total of 80.5 mm of rain, which is approximately 3.17 inches. Though this is somewhat less than the claimed four to five and a half inches, it is important to consider that ERA5 reanalysis data underestimates localized heavy rainfall, and the claim refers collectively to a broader region including eastern Ohio and western Pennsylvania. The peak single-day rainfall was 38.2 mm (1.5 inches), indicating significant heavy rain within the period. Given these considerations and the nature of disaster-reporting language, the claim that four to five and a half inches fell over four days across the region is supported as a reasonable summary.",get_historical_precipitation,1.0,supports,0.8,3,61.7,yes
1171768,Flood,PENNSYLVANIA,FAYETTE,Northeast,03-APR-24 07:30:00,39.7423,-79.4413,0.00K,0,supports,none,2,"A flood occurred in Fayette, Pennsylvania, USA, on April 3, 2024, from 07:30 to 11:30.",supports,"On April 3, 2024, the Fayette, Pennsylvania area recorded substantial rainfall (approximately 49.28 to 57.15 mm) which could contribute to flooding. Streamflow data from nearby USGS gauges shows high discharge levels on that day with annual peak events recorded, indicating high water flow consistent with flood conditions in the area. This evidence supports the claim of a flood event in Fayette, Pennsylvania on April 3, 2024, during the specified time range.","get_radar_gauge_precipitation, get_streamflow_history",1.0,supports,0.8,3,61.7,yes
1171768,Flood,PENNSYLVANIA,FAYETTE,Northeast,03-APR-24 07:30:00,39.7423,-79.4413,0.00K,0,supports,none,3,"The flood in Fayette, Pennsylvania, caused partial flooding of Caney Valley Road with one bridge under water near Henry Clay Township, Fayette County, Pennsylvania.",inconclusive,"The tools found that there was substantial precipitation (35.9 to 38.2 mm) on April 3, 2024, near Fayette, Pennsylvania and Henry Clay Township, which could cause flooding. A nearby water body (Cove Run stream) is present, which could plausibly be linked to flooding. However, there is no direct information from the tools about flooding on Caney Valley Road or any bridge being under water. Therefore, there is insufficient evidence to confirm or deny the specific details about the road and bridge flooding near Henry Clay Township.","find_nearest_water_body, get_historical_precipitation",0.4,supports,0.8,3,61.7,yes
1172437,Flash Flood,GEORGIA,BAKER,Southeast,10-APR-24 20:45:00,31.37,-84.63,0.00K,0,supports,none,1,"A flash flood occurred in Baker, Georgia, USA beginning on April 10, 2024 at 20:45 and ending on April 11, 2024 at 02:15.",supports,"The precipitation data for Baker, Georgia, shows a significant rainfall of 71.4 mm on April 11, 2024, following 2.9 mm on April 10, 2024. This substantial amount of rain over the claimed time period is consistent with the occurrence of a flash flood, supporting the claim.",get_historical_precipitation,1.0,supports,0.75,6,85.9,yes
1172437,Flash Flood,GEORGIA,BAKER,Southeast,10-APR-24 20:45:00,31.37,-84.63,0.00K,0,supports,none,2,"Flooding was reported on Hamill Road about 1 mile south of Patmos Milford Highway in Baker, Georgia, USA during the flash flood on April 10-11, 2024.",supports,"Precipitation data from NOAA PRISM and MRMS for the location of Baker, Georgia on April 10-11, 2024 show significant rainfall accumulation (118.11 mm by PRISM and 115.32 mm by MRMS) during the event period. Such heavy rainfall is consistent with flash flooding reports. Therefore, the claim that flooding was reported on Hamill Road about 1 mile south of Patmos Milford Highway in Baker, Georgia during April 10-11, 2024 is supported by the data.",get_radar_gauge_precipitation,1.0,supports,0.75,6,85.9,yes
1172437,Flash Flood,GEORGIA,BAKER,Southeast,10-APR-24 20:45:00,31.37,-84.63,0.00K,0,supports,none,3,"The cause of the flash flood in Baker, Georgia, USA on April 10-11, 2024 was heavy rain.",supports,"Radar and gauge data from NOAA PRISM and MRMS sources show significant precipitation at Baker, Georgia on April 10-11, 2024, with daily totals reaching as high as 118.11 mm (PRISM) and 115.32 mm (MRMS) combined over the two days. Such heavy rain is consistent with causing flash flooding. Therefore, the claim that the flash flood was caused by heavy rain is supported by the precipitation data.","get_historical_precipitation, get_radar_gauge_precipitation",1.0,supports,0.75,6,85.9,yes
1172437,Flash Flood,GEORGIA,BAKER,Southeast,10-APR-24 20:45:00,31.37,-84.63,0.00K,0,supports,none,4,"The Godby High School campus in Tallahassee, Florida was flooded during the April 10-11, 2024 flash flood, resulting in at least $250,000 in damage.",inconclusive,"There is no specific evidence available from the provided data to confirm or deny that the Godby High School campus in Tallahassee, Florida was flooded or that it resulted in at least $250,000 in damage during the April 10-11, 2024 flash flood.",,0.0,supports,0.75,6,85.9,yes
1172437,Flash Flood,GEORGIA,BAKER,Southeast,10-APR-24 20:45:00,31.37,-84.63,0.00K,0,supports,none,5,"Between 6 and 10 inches of rain fell with localized higher amounts over Tallahassee, Florida, during the April 10-11, 2024 flash flood event.",supports,"The PRISM precipitation data shows a total of 189.99 mm for April 10-11, 2024, which converts to approximately 7.48 inches of rain (1 inch = 25.4 mm). The MRMS estimate for the same period is about 6.27 inches. Both estimates fall within the claim's range of 6 to 10 inches, supporting the claim that between 6 and 10 inches of rain fell in Tallahassee during the event.",get_radar_gauge_precipitation,,supports,0.75,6,85.9,yes
1172437,Flash Flood,GEORGIA,BAKER,Southeast,10-APR-24 20:45:00,31.37,-84.63,0.00K,0,supports,none,6,"A major flash flood event occurred across portions of the Florida Big Bend and southern Georgia from late night April 10, 2024 through early morning April 11, 2024.",supports,"Radar-gauge precipitation data shows very heavy rainfall on April 11, 2024, with daily totals of up to approximately 190 mm in the Florida Big Bend area and around 150-170 mm in southern Georgia. Such intense rainfall supports the occurrence of a major flash flood event. Streamflow data from nearby USGS gauges do not show record peaks but this could be due to lack of instantaneous peak data in the short time window. The very high rainfall totals in the relevant time and location support the claim of a major flash flood event during the specified period.","get_historical_precipitation, get_radar_gauge_precipitation, get_streamflow_history",,supports,0.75,6,85.9,yes
1173713,Flash Flood,TEXAS,NEWTON,Gulf Coast,10-APR-24 01:28:00,30.6355,-93.8182,0.00K,0,supports,none,1,"Deputy reports indicated that 4 to 5 inches of water were over area roads near Trout Creek, Newton County, Texas during the flash flood on April 10, 2024.",supports,"The precipitation data from NOAA's PRISM and MRMS indicates that the area near Trout Creek, Newton County, Texas received between 228.85 mm (MRMS) and 330.2 mm (PRISM) of rainfall on April 10, 2024. This converts to approximately 9 to 13 inches of rain, which supports the claim that 4 to 5 inches of water were observed over area roads during the flash flood, as the rainfall depth is sufficient to produce such floodwater depths.","get_radar_gauge_precipitation, get_streamflow_history",0.6,supports,0.6,3,23.6,yes
1173713,Flash Flood,TEXAS,NEWTON,Gulf Coast,10-APR-24 01:28:00,30.6355,-93.8182,0.00K,0,supports,none,2,"A flash flood occurred in Newton, Texas from 01:28 AM to 03:28 AM on April 10, 2024.",supports,"The precipitation data from April 10, 2024, in Newton, Texas, shows a substantial rainfall of 30.3 mm, which is a significant amount indicating heavy rainfall. The USGS streamflow data for nearby gauges on the same day also show high river discharge rates, indicating substantial water flow likely associated with flooding. These data support that a flash flood likely occurred during the specified time frame on April 10, 2024, in Newton, Texas.","get_historical_precipitation, get_streamflow_history",0.6,supports,0.6,3,23.6,yes
1173713,Flash Flood,TEXAS,NEWTON,Gulf Coast,10-APR-24 01:28:00,30.6355,-93.8182,0.00K,0,supports,none,3,"The flash flood near Trout Creek in Newton County, Texas was caused by heavy rain on April 10, 2024.",inconclusive,"There is information about a flash flood event near Trout Creek in Newton County, Texas on April 10, 2024, but no specific evidence confirming that it was caused by heavy rain.",,0.6,supports,0.6,3,23.6,yes
1179449,Flash Flood,CONNECTICUT,HARTFORD,Northeast,21-JUN-24 16:25:00,41.8096,-72.8305,0.00K,0,supports,none,1,"The flash flood in Hartford, Connecticut on June 21, 2024, was caused by heavy rain.",supports,"Radar+gauge precipitation data for Hartford, Connecticut on June 21, 2024, shows a high rainfall total of 51.31 mm measured by the MRMS product, indicating heavy rain during the time of the flash flood. This supports the claim that the flash flood was caused by heavy rain.",get_radar_gauge_precipitation,1.0,supports,0.8,2,33.0,yes
1179449,Flash Flood,CONNECTICUT,HARTFORD,Northeast,21-JUN-24 16:25:00,41.8096,-72.8305,0.00K,0,supports,none,2,"Parts of Rt 44 in Avon, Connecticut had flooding with water covering the road during the flash flood on June 21, 2024.",supports,"The NOAA MRMS radar+gauge precipitation data indicates 51.31 mm of rainfall on June 21, 2024, at the location of Rt 44 in Avon, Connecticut, which is a substantial amount consistent with conditions that could cause flooding and water covering the road, supporting the claim of flooding during the flash flood.",get_radar_gauge_precipitation,0.6,supports,0.8,2,33.0,yes
1182085,Flash Flood,NEBRASKA,CHEYENNE,Other,14-JUN-24 18:57:00,41.3284,-102.9981,0.00K,0,supports,none,1,"A flash flood occurred in Cheyenne County, Nebraska, USA beginning on June 14, 2024 at 18:57 caused by heavy rain.",inconclusive,"The MRMS radar+gauge precipitation data shows there was heavy rain on June 14, 2024 with 52.32 mm of rain recorded in Cheyenne County, Nebraska. However, the data does not directly confirm that a flash flood occurred beginning at 18:57 on June 14. There is no direct measurement or report of flooding in the available data to confirm or deny the presence of a flash flood caused by this rain.",get_radar_gauge_precipitation,0.2,contradicts,0.2,3,30.7,no
1182085,Flash Flood,NEBRASKA,CHEYENNE,Other,14-JUN-24 18:57:00,41.3284,-102.9981,0.00K,0,supports,none,2,"Multiple rounds of training thunderstorms produced an extended period of torrential rainfall across Cheyenne County and Morrill County, Nebraska, USA from mid to late afternoon into early evening hours on June 14, 2024.",supports,"The MRMS radar+gauge data shows a very high rainfall total of 67.56 mm for a location in Cheyenne County (41.25, -103.0) on June 14, 2024, which supports the claim of torrential rainfall and multiple rounds of thunderstorms producing an extended period of heavy rain in that area. Although the rainfall is less (5.08 mm) at the sampled point in Morrill County (41.65, -103.15), the claim is about an extended period across both counties with heavy rain in at least part of the region. The high 67.56 mm total in Cheyenne County corresponds with the described timing and severity of rainfall. Therefore, the claim is supported by the evidence.",get_radar_gauge_precipitation,0.4,contradicts,0.2,3,30.7,no
1182085,Flash Flood,NEBRASKA,CHEYENNE,Other,14-JUN-24 18:57:00,41.3284,-102.9981,0.00K,0,supports,none,3,"Numerous reports indicated rainfall amounts ranging from 3 to 5 inches over a short period on June 14, 2024, causing flash flooding of several county roads due to creeks and streams overflowing in Cheyenne County and Morrill County, Nebraska, USA.",contradicts,"The rainfall data for June 14, 2024, from NOAA radar+gauge precipitation shows that in Cheyenne County near lat 41.2506, lon -103.0548, the MRMS radar+gauge precipitation was about 45.21 mm (approximately 1.78 inches), and in Morrill County near lat 41.8164, lon -103.3009, it was about 1.78 mm (approximately 0.07 inches). Both are significantly below the claimed 3 to 5 inches. The PRISM data shows 0 mm, indicating no gauge-confirmed heavy rainfall that day. Thus, the claim of 3 to 5 inches causing flash flooding is contradicted by the observational data.","get_radar_gauge_precipitation, get_streamflow_history",0.0,contradicts,0.2,3,30.7,no
1185225,Flash Flood,TEXAS,BROWN,Gulf Coast,04-MAY-24 23:45:00,31.96,-98.92,0.00K,0,supports,none,1,"A flash flood occurred in Brown County, Texas, beginning on May 4, 2024, at 23:45 due to heavy rain.",inconclusive,No direct evidence or data is available to confirm that a flash flood occurred exactly at the stated time and location due to heavy rain. The metadata and entities involved do not provide specific event confirmation or details about this flash flood event.,,0.0,inconclusive,0.0,2,24.2,partial
1185225,Flash Flood,TEXAS,BROWN,Gulf Coast,04-MAY-24 23:45:00,31.96,-98.92,0.00K,0,supports,none,2,"The Texas Department of Transportation reported that US 183 from Early, Texas to the Brown/Eastland County line had been closed due to flooding on May 4, 2024.",inconclusive,"There is no direct evidence available from the tools or metadata provided to confirm or contradict the report by the Texas Department of Transportation about the closure of US 183 from Early, Texas to the Brown/Eastland County line due to flooding on May 4, 2024.",,0.0,inconclusive,0.0,2,24.2,partial
1187478,Flash Flood,TEXAS,JOHNSON,Gulf Coast,30-MAY-24 14:45:00,32.38,-97.44,0.00K,0,supports,none,1,"Emergency Management reported that CR 1224 and CR 1121 in Cleburne, Texas were closed due to flooding on May 30, 2024.",inconclusive,"No specific evidence found in available data to confirm or refute that Emergency Management reported CR 1224 and CR 1121 in Cleburne, Texas were closed due to flooding on May 30, 2024.",,0.0,supports,0.222,3,35.7,yes
1187478,Flash Flood,TEXAS,JOHNSON,Gulf Coast,30-MAY-24 14:45:00,32.38,-97.44,0.00K,0,supports,none,2,"The flash flood in Johnson County, Texas, USA on May 30, 2024 was caused by heavy rain.",supports,"The NOAA MRMS radar+gauge data for Johnson County, Texas on May 30, 2024 shows a heavy rainfall amount of 32.26 mm, which is consistent with heavy rain causing the flash flood reported in that area and date.","get_historical_precipitation, get_radar_gauge_precipitation",0.667,supports,0.222,3,35.7,yes
1187478,Flash Flood,TEXAS,JOHNSON,Gulf Coast,30-MAY-24 14:45:00,32.38,-97.44,0.00K,0,supports,none,3,"A flash flood occurred in Johnson County, Texas, USA from 14:45 to 15:45 on May 30, 2024.",inconclusive,"The historical precipitation data for May 30, 2024, at Johnson County coordinates shows 4.3 mm of rainfall, which is relatively low and not strongly indicative of a flash flood. The streamflow data from nearby gauges on the same day shows no record or peak event indicating flash flooding. The data does not confirm or directly contradict a flash flood occurring during the specified one-hour window. Therefore, there is insufficient evidence to verify the claim of a flash flood.","get_historical_precipitation, get_streamflow_history",0.0,supports,0.222,3,35.7,yes
1190188,Flood,IOWA,CLAY,Midwest,17-JUN-24 19:00:00,43.13,-95.29,0.00K,0,supports,none,1,"The Ocheyedan River near Spencer, Iowa rose above flood stage on the evening of June 17, 2024 and crested at approximately 9.20 feet above flood stage (17.20 feet) on June 22, 2024, breaking the previous record and reaching major flood stage, with the river remaining above flood stage into July.",inconclusive,"No specific measurement data or record-breaking information about the Ocheyedan River near Spencer, Iowa for the specified time range in June 2024 is available in the provided metadata or in general knowledge sources. Therefore, the claim cannot be directly confirmed or refuted based on the available evidence.",,0.0,contradicts,0.083,3,22.7,no
