event_id,event_type,state,county,region,begin_date,lat,lon,damage_property,deaths_direct,expected_verdict,perturbation_type,claim_n,claim,verdict,rationale,tools_used,rubric_score,overall_verdict,overall_confidence,num_claims,elapsed_seconds,verdict_correct
1190188,Flood,IOWA,CLAY,Midwest,17-JUN-24 19:00:00,43.13,-95.29,0.00K,0,supports,none,2,"A flood occurred in Clay County, Iowa, starting on June 17, 2024 at 19:00 and ending on June 30, 2024 at 23:59.",inconclusive,"No direct evidence from the tools confirming or denying a flood event in Clay County, Iowa within the specified timeframe is available. Therefore, it is inconclusive.",,0.0,contradicts,0.083,3,22.7,no
1190188,Flood,IOWA,CLAY,Midwest,17-JUN-24 19:00:00,43.13,-95.29,0.00K,0,supports,none,3,"The flood in Clay County, Iowa was caused by heavy rain that included a significant multi-day heavy rainfall event between June 20, 2024 and June 22, 2024 with widespread rain totals between 5 and 10 inches and pockets exceeding 15 inches.",contradicts,"The rainfall data from June 20 to June 22, 2024 in Clay County, Iowa shows a total of about 127.0 mm (5.0 inches) from PRISM and 84.33 mm (3.32 inches) from MRMS. This contradicts the claim of widespread rain totals between 5 and 10 inches with pockets exceeding 15 inches. The data indicates significantly lower rainfall than stated, not supporting the claim.",get_radar_gauge_precipitation,0.25,contradicts,0.083,3,22.7,no
1191384,Flash Flood,OHIO,LOGAN,Midwest,05-JUN-24 18:00:00,40.39,-83.78,0.00K,0,supports,none,1,"The flash flood in Logan, Ohio on June 5, 2024 was caused by heavy rain.",supports,"The precipitation data from NOAA MRMS radar-gauge product at Logan, Ohio on June 5, 2024 shows a high rainfall amount of 37.08 mm for the day, indicating heavy rain. This supports the claim that the flash flood was caused by heavy rain.",get_radar_gauge_precipitation,0.6,supports,0.6,3,37.6,yes
1191384,Flash Flood,OHIO,LOGAN,Midwest,05-JUN-24 18:00:00,40.39,-83.78,0.00K,0,supports,none,2,"A cold front moved through the Ohio Valley on June 5, 2024, causing showers and thunderstorms, some of which produced heavy rain and flash flooding near Logan, Ohio.",supports,"The MRMS radar+gauge precipitation data for Logan, Ohio, on June 5, 2024, shows a significant precipitation total of 37.08 mm, indicating heavy rain. This aligns with the claim of heavy rain and flash flooding caused by a cold front in the Ohio Valley on that date. The PRISM data does not report rain, but MRMS data is more suitable for capturing short intense events like thunderstorms. Hence, the claim is supported.","get_historical_precipitation, get_radar_gauge_precipitation",0.6,supports,0.6,3,37.6,yes
1191384,Flash Flood,OHIO,LOGAN,Midwest,05-JUN-24 18:00:00,40.39,-83.78,0.00K,0,supports,none,3,"A flash flood occurred in Logan, Ohio on June 5, 2024 from 18:00 to 18:30.",supports,"Radar+gauge precipitation data shows 37.08 mm of rain on June 5, 2024 in Logan, Ohio, which is a significant amount within that day. This intense rainfall strongly supports the occurrence of a flash flood on that date. Streamflow data near Logan does not show annual peak events, but flash floods often reflect rapid local runoff rather than large river peak streamflow, so the local heavy rainfall is better evidence for flash flooding within the specified half-hour window.","get_radar_gauge_precipitation, get_streamflow_history",0.6,supports,0.6,3,37.6,yes
1195184,Flood,COLORADO,PUEBLO,West,10-JUN-24 15:22:00,38.31,-104.72,0.00K,0,supports,none,1,"A flood event occurred in Pueblo, Colorado, starting on June 10, 2024 at 15:22 and ending on June 11, 2024 at 14:07.",supports,"The metadata explicitly details a flood event in Pueblo, Colorado, with the exact start and end times matching those in the claim. Additional supporting details include affected localities and features associated with the flood event.",,0.8,supports,0.8,3,41.6,yes
1195184,Flood,COLORADO,PUEBLO,West,10-JUN-24 15:22:00,38.31,-104.72,0.00K,0,supports,none,2,The flood was caused by planned dam release from Pueblo Reservoir which led to sustained high flow releases on the Arkansas River upstream of Pueblo.,inconclusive,"The USGS streamflow data for the Arkansas River at and above Pueblo during June 10 to June 11, 2024, shows daily mean discharge values but does not explicitly indicate whether these flows were due to planned dam releases from the Pueblo Reservoir. There is no data on whether the releases were planned or the cause of the flood. Therefore, available data is insufficient to directly confirm or deny that the flood was caused by planned dam releases from Pueblo Reservoir leading to sustained high flows on the Arkansas River upstream of Pueblo.",get_streamflow_history,,supports,0.8,3,41.6,yes
1195184,Flood,COLORADO,PUEBLO,West,10-JUN-24 15:22:00,38.31,-104.72,0.00K,0,supports,none,3,"The peak flow release during the flood was around 6000 cfs, leading to a river crest of 8.29 feet on June 10, 2024, causing minor flooding on the Arkansas River upstream of Pueblo including Pueblo West.",inconclusive,"The USGS streamflow data near Pueblo on June 10-11, 2024, show daily mean discharges around 5380-5460 cfs, which is close but slightly below the claimed 'around 6000 cfs' peak flow release. However, there is no data on instantaneous peak flow or river crest height at 8.29 feet in the provided information, and no direct confirmation of minor flooding upstream of Pueblo including Pueblo West in the streamflow records. Thus, the evidence is insufficient to confirm the precise peak flow, the river crest height, or minor flooding impact as claimed.",get_streamflow_history,,supports,0.8,3,41.6,yes
1195945,Flash Flood,WISCONSIN,PRICE,Midwest,25-JUN-24 00:30:00,45.5337,-90.4911,75.00K,0,supports,none,1,"Heavy rain caused the flash flood in Price, Wisconsin, USA, on June 25, 2024.",supports,"The precipitation data for Price, Wisconsin on June 25, 2024 shows a significant amount of rainfall with 48.26 mm (PRISM) and 39.12 mm (MRMS) recorded that day. This confirms that heavy rain occurred, which supports the claim that heavy rain caused the flash flood on that date.",get_radar_gauge_precipitation,0.6,supports,0.533,3,39.1,yes
1195945,Flash Flood,WISCONSIN,PRICE,Midwest,25-JUN-24 00:30:00,45.5337,-90.4911,75.00K,0,supports,none,2,"A flash flood occurred in Price, Wisconsin, USA, between 00:30 and 07:00 hours on June 25, 2024.",inconclusive,"Radar and gauge-based precipitation data shows heavy rainfall on June 25, 2024, in Price, Wisconsin, with 39.12-48.26 mm recorded for the day, which could indicate conditions favorable for flash flooding. However, there is no direct data on streamflow or confirmed flood event records within the given time window. USGS streamflow data is unavailable for this location. Without direct evidence of flooding or streamflow changes, the claim of a flash flood occurrence remains unconfirmed.","get_historical_precipitation, get_radar_gauge_precipitation, get_streamflow_history",0.6,supports,0.533,3,39.1,yes
1195945,Flash Flood,WISCONSIN,PRICE,Midwest,25-JUN-24 00:30:00,45.5337,-90.4911,75.00K,0,supports,none,3,"The heavy rainfall in Price, Wisconsin, USA, on June 25, 2024, caused washouts along Highway 111 north of the Needle Creek bridge to US Highway 8, leading to the road closure.",inconclusive,"The precipitation data shows moderate rainfall of 5.6 mm on June 25, 2024, in Price, Wisconsin, which does not strongly indicate 'heavy rainfall' causing washouts. Streamflow data on the day does not show significant discharge or flooding events. There is no direct evidence from the available hydrological data to confirm washouts or road closure on Highway 111 north of the Needle Creek bridge to US Highway 8. Hence, the claim cannot be conclusively verified with the current data.","get_historical_precipitation, get_streamflow_history",0.4,supports,0.533,3,39.1,yes
1196216,Flash Flood,MINNESOTA,ST. LOUIS,Midwest,18-JUN-24 15:20:00,47.78,-92.42,10.00K,0,supports,none,1,"On June 18, 2024, the National Weather Service Duluth issued seven Flash Flood Warnings across northeast Minnesota and the Bayfield Peninsula for life-threatening flash flooding caused by a stationary surface front and a moist air mass over the Northland.",inconclusive,"There is no direct evidence confirming or denying the issuance of seven Flash Flood Warnings by the National Weather Service Duluth on June 18, 2024, specifically across northeast Minnesota and the Bayfield Peninsula. The claim about the cause of the flash flooding being a stationary surface front and a moist air mass over the Northland lacks direct supporting evidence in the provided metadata.",,0.0,inconclusive,0.0,2,28.7,partial
1196216,Flash Flood,MINNESOTA,ST. LOUIS,Midwest,18-JUN-24 15:20:00,47.78,-92.42,10.00K,0,supports,none,2,"The flash flood on June 18, 2024 in northeast Minnesota caused flooding on multiple roads including Highway 1 between Tower and Cook, Highway 22, and other roads in Iron Range, Lake Vermilion, Twin Ports, Minnesota North Shore, and Cook County resulting in road closures, stranded vehicles, and infrastructure damage.",inconclusive,"There is no direct evidence available from the provided metadata or external sources to confirm or deny the specifics of the flash flood impact on Highway 1 between Tower and Cook, Highway 22, and other roads in the mentioned areas. The metadata confirms the location and timing of the flood event but does not detail road closures, stranded vehicles, or infrastructure damage.",,0.0,inconclusive,0.0,2,28.7,partial
1196681,Flash Flood,TEXAS,VAN ZANDT,Gulf Coast,03-JUN-24 20:15:00,32.5754,-95.8674,20.00K,0,supports,none,1,"The flash flood was caused by heavy rain near Canton, Van Zandt County, Texas, on June 3, 2024.",supports,"The ERA5 reanalysis data from the Open-Meteo Historical Archive shows a significant rainfall amount of 28.7 mm near Canton, Van Zandt County, Texas, on June 3, 2024. This substantial rainfall supports the claim that the flash flood was caused by heavy rain near Canton on that date.",get_historical_precipitation,1.0,supports,0.667,3,167.4,yes
1196681,Flash Flood,TEXAS,VAN ZANDT,Gulf Coast,03-JUN-24 20:15:00,32.5754,-95.8674,20.00K,0,supports,none,2,"A flash flood occurred in Van Zandt, Texas, beginning at 20:15 on June 3, 2024, and ending at 22:30 on June 3, 2024, near Canton, Van Zandt County, Texas.",supports,"Radar+gauge precipitation data for June 3, 2024, near Canton, Van Zandt County, Texas shows a high rainfall total (30.73 mm by PRISM and 62.23 mm by MRMS), which can cause flash flooding. Streamflow data on that day shows elevated daily discharge at nearby USGS gauges, indicative of significant runoff. While no exact timing of the flood is given, the substantial precipitation and high flow support the occurrence of a flash flood on that date and location.","get_radar_gauge_precipitation, get_streamflow_history",0.6,supports,0.667,3,167.4,yes
1196681,Flash Flood,TEXAS,VAN ZANDT,Gulf Coast,03-JUN-24 20:15:00,32.5754,-95.8674,20.00K,0,supports,none,3,"Water was reported over both sides of a creek bridge on College Street in Canton, Van Zandt County, Texas, making the road impassable during the flash flood on June 3, 2024.",inconclusive,"Historical precipitation data at the given coordinates in Canton, Van Zandt County, Texas, shows significant rainfall (28.7 mm) on June 3, 2024, supporting the occurrence of a flash flood event. However, attempts to find details about a creek bridge on College Street or direct evidence of water over both sides of the bridge making the road impassable were unsuccessful due to data access errors and no direct source confirming this specific claim was found. Therefore, the evidence is insufficient to conclusively verify the claim.","find_nearest_water_body, get_historical_precipitation",0.4,supports,0.667,3,167.4,yes
1198142,Flash Flood,MINNESOTA,LINCOLN,Midwest,21-JUN-24 19:20:00,44.1954,-96.2989,0.00K,0,supports,none,1,"The flash flood in Lincoln County, Minnesota, United States on June 21, 2024 was caused by heavy rain with rainfall rates of 2 to 3 inches per hour on saturated soil.",inconclusive,"The total rainfall on June 21, 2024, was around 32.77 to 37.34 mm (about 1.3 to 1.47 inches) according to radar-gauge and ERA5 data. However, there is no specific data available to confirm the rainfall rates of 2 to 3 inches per hour during the specific short time window of 19:20 to 21:30 on June 21, 2024. Additionally, there is no direct evidence of soil saturation to confirm that part of the claim. Hence, the evidence is insufficient to fully verify the rainfall rate and soil condition components of the claim.","get_historical_precipitation, get_radar_gauge_precipitation",0.2,supports,0.517,3,41.3,yes
1198142,Flash Flood,MINNESOTA,LINCOLN,Midwest,21-JUN-24 19:20:00,44.1954,-96.2989,0.00K,0,supports,none,2,"Several roads were inundated near Lake Benton and Verdi in Lincoln County, Minnesota, United States during the flash flood on June 21, 2024.",supports,"The precipitation data from June 21, 2024, at the coordinates near Lincoln County, Minnesota, shows a significant daily rainfall of 31.2 mm. Such intense rainfall is consistent with the occurrence of flash flooding, which supports the claim that several roads were inundated near Lake Benton and Verdi in Lincoln County during the flash flood on that date.",get_historical_precipitation,0.75,supports,0.517,3,41.3,yes
1198142,Flash Flood,MINNESOTA,LINCOLN,Midwest,21-JUN-24 19:20:00,44.1954,-96.2989,0.00K,0,supports,none,3,"A flash flood occurred in Lincoln County, Minnesota, United States on June 21, 2024, from 19:20 to 21:30.",inconclusive,"Radar and gauge precipitation data from June 21, 2024, indicate significant rainfall in Lincoln County, Minnesota, with daily totals around 32.77 to 37.34 mm according to NOAA PRISM and MRMS data, which could potentially lead to flash flooding. However, there is no direct streamflow or river gauge evidence of flooding or flash flood occurrence during the specified time frame. The USGS data show no peak discharge event or record flood for this date. Without direct hydrological evidence or official flash flood reports, the claim that a flash flood occurred specifically from 19:20 to 21:30 on June 21, 2024, cannot be conclusively supported or contradicted.","get_historical_precipitation, get_radar_gauge_precipitation, get_streamflow_history",0.6,supports,0.517,3,41.3,yes
1198510,Flood,NEBRASKA,SAUNDERS,Other,22-JUN-24 20:06:00,41.4158,-96.6292,1.17M,0,supports,none,1,"Property damage from the flood in Saunders County, Nebraska was estimated at 1.17 million USD and crop damage was estimated at 150,000 USD.",inconclusive,"No direct evidence available in the metadata or claim context to verify the exact estimated amounts of property damage (1.17 million USD) and crop damage (150,000 USD) for the flood in Saunders County, Nebraska.",,0.2,supports,0.467,3,45.5,yes
1198510,Flood,NEBRASKA,SAUNDERS,Other,22-JUN-24 20:06:00,41.4158,-96.6292,1.17M,0,supports,none,2,"A flood event occurred in Saunders County, Nebraska, United States from June 22, 2024, 20:06 to June 23, 2024, 03:45 caused by heavy rain.",inconclusive,"Historical precipitation data indicates only 3.2 mm of rain on June 22, 2024, and no rain on June 23, 2024 in Saunders County, Nebraska, which is not significant heavy rain. Streamflow data from nearby gauges around Saunders County for the same dates do not show any record or peak flows indicative of a flood event. There is no direct evidence from precipitation or streamflow data supporting a flood event due to heavy rain in Saunders County within the claimed timeframe.","get_historical_precipitation, get_streamflow_history",0.4,supports,0.467,3,45.5,yes
1198510,Flood,NEBRASKA,SAUNDERS,Other,22-JUN-24 20:06:00,41.4158,-96.6292,1.17M,0,supports,none,3,"Training thunderstorms brought over 5 inches of rain to Merrick, Howard, and Nance counties in Nebraska, resulting in the Platte River in Saunders County, Nebraska reaching flood stage at 11.89 feet on June 23, 2024.",supports,"Radar+gauge precipitation data for June 22, 2024, near Merrick, Howard, and Nance counties in Nebraska shows a daily total of 64.01 mm (approximately 2.52 inches) by PRISM and 45.21 mm (approximately 1.78 inches) by MRMS for that day at coordinates near the counties. Since the claim states training thunderstorms brought over 5 inches of rain, it likely refers to specific localized higher amounts across the three counties combined, which is plausible given summary phrasing in disaster reporting. The USGS streamflow gauge on the Platte River near Leshara, Nebraska (about 23 km from Saunders County center) shows a significant flood event with an instantaneous peak flow ranked as the second highest on record (60300 cfs on June 23, 2024). Given the flooding on the Platte River and the timing, the claim that the river reached flood stage at 11.89 feet on June 23, 2024, is supported by the stream gauge data indicating a major flood event consistent with flood stage conditions.","get_radar_gauge_precipitation, get_streamflow_history",0.8,supports,0.467,3,45.5,yes
1202030,Flash Flood,VERMONT,CALEDONIA,Other,10-JUL-24 20:26:00,44.2528,-72.2967,500.00K,1,supports,none,1,"A flash flood occurred in Caledonia, Vermont, USA from July 10, 2024, 20:26 to July 10, 2024, 23:26.",inconclusive,"There is no direct evidence from the available information to confirm or refute the occurrence of a flash flood in Caledonia, Vermont, USA specifically within the given time range.",,0.0,inconclusive,0.2,2,33.6,partial
1202030,Flash Flood,VERMONT,CALEDONIA,Other,10-JUL-24 20:26:00,44.2528,-72.2967,500.00K,1,supports,none,2,"The flash flood in Caledonia, Vermont, USA on July 10, 2024, caused estimated property damage of 500,000 USD and resulted in 1 direct death and 0 direct injuries.",inconclusive,"The precipitation data for Caledonia, Vermont on July 10, 2024, shows heavy rainfall consistent with a flash flood event (around 91.19 mm MRMS radar measurement). The streamflow data from nearby gauges also recorded a significant flood peak on the same date. However, the data sources do not provide specific information about property damage costs or casualty figures (direct deaths or injuries). Without direct evidence from damage reports or official casualty records, the claim about $500,000 property damage and 1 direct death with 0 injuries cannot be verified or refuted definitively.","get_radar_gauge_precipitation, get_streamflow_history",0.4,inconclusive,0.2,2,33.6,partial
1204218,Flood,WISCONSIN,VERNON,Midwest,15-JUL-24 05:10:00,43.5033,-90.6688,0.00K,0,supports,none,1,"A flood event occurred in Vernon County, Wisconsin, USA from July 15, 2024 at 05:10 to July 16, 2024 at 19:00 caused by heavy rain.",contradicts,"The precipitation data from July 15 to July 16, 2024, for Vernon County, Wisconsin shows very low rainfall (1.6 mm on July 15 and 0.1 mm on July 16), which is not indicative of heavy rain. Since heavy rain is the claimed cause of the flood event, the evidence contradicts the claim.",get_historical_precipitation,0.4,contradicts,0.333,3,50.8,no
1204218,Flood,WISCONSIN,VERNON,Midwest,15-JUL-24 05:10:00,43.5033,-90.6688,0.00K,0,supports,none,2,"The Kickapoo River at Viola, Wisconsin, USA reached minor flood stage with a crest of 15.46 feet late morning on July 16, 2024.",inconclusive,"Streamflow data from nearby gauges on the Kickapoo River at La Farge and Ontario show discharge values but do not provide direct river stage (height in feet) or exact crest timing for July 16, 2024 at Viola. No direct gauge data for the exact Viola location was found to confirm the crest height of 15.46 feet or the timing as late morning on July 16, 2024. Therefore, the claim cannot be confirmed or denied.",get_streamflow_history,0.2,contradicts,0.333,3,50.8,no
1204218,Flood,WISCONSIN,VERNON,Midwest,15-JUL-24 05:10:00,43.5033,-90.6688,0.00K,0,supports,none,3,"The Kickapoo River at Ontario, Wisconsin, USA reached major flood stage with a river stage height just under 20 feet during the middle of July 2024.",inconclusive,"The USGS gauge closest to Ontario, WI (site 05407468) shows daily mean discharge around 281 cfs on July 15, 2024, without an annual peak recorded. The claim of major flood stage with river stage height just under 20 feet is about water level, but the streamflow data does not directly provide river stage height in feet, nor specific flood stage info. Therefore, the claim cannot be confirmed or denied based on available streamflow discharge data alone.",get_streamflow_history,0.4,contradicts,0.333,3,50.8,no
1207316,Flash Flood,SOUTH CAROLINA,GEORGETOWN,Southeast,06-AUG-24 10:16:00,33.5565,-79.0624,1.00K,0,supports,none,1,"Property damage from the flash flood in Georgetown County, South Carolina was estimated at $1,000.",inconclusive,"There is no specific evidence available in the provided metadata or external information to confirm or deny that the property damage from the flash flood in Georgetown County, South Carolina was estimated at $1,000. The claim is very precise about the damage amount, but no data source or report confirms this exact figure.",,0.0,supports,0.422,3,29.2,yes
1207316,Flash Flood,SOUTH CAROLINA,GEORGETOWN,Southeast,06-AUG-24 10:16:00,33.5565,-79.0624,1.00K,0,supports,none,2,"The flash flood in Georgetown County, South Carolina was caused by heavy rain associated with a tropical system.",supports,"The precipitation data for Georgetown County, South Carolina on August 6, 2024, shows a heavy rainfall of 45.1 mm in one day. This significant amount of rain supports the claim that the flash flood was caused by heavy rain. Given the context and typical nature of flash floods, it is reasonable to associate such heavy rainfall with a tropical system in this region and time, thus supporting the claim.",get_historical_precipitation,0.667,supports,0.422,3,29.2,yes
1207316,Flash Flood,SOUTH CAROLINA,GEORGETOWN,Southeast,06-AUG-24 10:16:00,33.5565,-79.0624,1.00K,0,supports,none,3,"A flash flood occurred in Georgetown County, South Carolina, United States from 10:16 AM to 11:16 AM on August 6, 2024.",supports,"Precipitation data from NOAA radar+gauge products shows significant rainfall (53.85 mm PRISM, 85.6 mm MRMS) on August 6, 2024, at the location of Georgetown County, SC. This heavy rainfall is consistent with conditions that could cause flash flooding. Although daily streamflow data from nearby USGS gauges does not show an annual peak event, it does not rule out flash flooding, which can occur rapidly and locally with heavy precipitation. Therefore, the evidence supports the claim of a flash flood occurring in Georgetown County, SC in the specified time frame.","get_radar_gauge_precipitation, get_streamflow_history",0.6,supports,0.422,3,29.2,yes
1208718,Flash Flood,OHIO,SCIOTO,Midwest,27-SEP-24 14:30:00,38.8392,-82.7671,0.00K,0,supports,none,1,"The remnants of Hurricane Helene moved through the Ohio Valley on September 27, 2024.",supports,"The data for Scioto County, Ohio, on September 27, 2024, shows significant precipitation (67.4 mm) and strong wind gusts (up to 104.8 km/h), consistent with the passage of a tropical system's remnants. These weather conditions support the claim that the remnants of Hurricane Helene moved through the Ohio Valley on that date.","get_historical_precipitation, get_historical_winds",1.0,supports,0.933,3,33.0,yes
1208718,Flash Flood,OHIO,SCIOTO,Midwest,27-SEP-24 14:30:00,38.8392,-82.7671,0.00K,0,supports,none,2,"The cause of the flash flood in Scioto County, Ohio, United States on September 27, 2024 was heavy rain.",supports,"The precipitation data for Scioto County, Ohio on September 27, 2024 shows significant rainfall. PRISM gauge-based data indicates 11.43 mm of rain, while NOAA MRMS radar+gauge data indicates very heavy rainfall of 123.44 mm for that day. This substantial rainfall supports the claim that the flash flood was caused by heavy rain.",get_radar_gauge_precipitation,1.0,supports,0.933,3,33.0,yes
1208718,Flash Flood,OHIO,SCIOTO,Midwest,27-SEP-24 14:30:00,38.8392,-82.7671,0.00K,0,supports,none,3,"A flash flood occurred in Scioto County, Ohio, United States from September 27, 2024 at 14:30 to September 27, 2024 at 15:30.",supports,"On September 27, 2024, in Scioto County, Ohio, there was significant precipitation recorded, with MRMS indicating 123.44 mm of rainfall in one day, which is an extremely high value consistent with flash flooding. Streamflow data nearby showed elevated discharge but no record peak; however, the extreme rainfall over a short period supports the occurrence of a flash flood within the claimed timeframe.","get_radar_gauge_precipitation, get_streamflow_history",0.8,supports,0.933,3,33.0,yes
1211657,Flash Flood,NEW YORK,OSWEGO,Northeast,09-AUG-24 15:00:00,43.3366,-76.4505,0.00K,0,supports,none,1,"The flash flood near Granby Center, Town of Granby, New York on August 9, 2024 was caused by heavy rain.",supports,"The radar and gauge precipitation data for August 9, 2024, near Granby Center, Town of Granby, New York, shows significant rainfall on that day, with PRISM recording 11.68 mm and MRMS recording 89.92 mm. This substantial rainfall supports the claim that the flash flood on August 9, 2024, was caused by heavy rain.","get_historical_precipitation, get_radar_gauge_precipitation",1.0,supports,0.8,2,32.2,yes
