event_id,event_type,state,county,region,begin_date,lat,lon,damage_property,deaths_direct,expected_verdict,perturbation_type,claim_n,claim,verdict,rationale,tools_used,rubric_score,overall_verdict,overall_confidence,num_claims,elapsed_seconds,verdict_correct
1151706,Flood,ILLINOIS,KANKAKEE,Midwest,18-JAN-24 11:00:00,41.0694,-87.8164,0.00K,0,supports,none,1,"A flood caused by an ice jam occurred in Kankakee, Illinois from January 18, 2024 at 11:00 to January 26, 2024 at 12:00.",supports,"The metadata specifies the event as a flood in Kankakee, Illinois, occurring from January 18, 2024, at 11:00 to January 26, 2024, at 12:00. The entities involved include the Kankakee River, which is relevant to ice jams causing floods. The river basin is also identified as the Kankakee River. This information supports the claim that the flood was caused by an ice jam during this specific time range in Kankakee, Illinois.",,1.0,supports,0.667,3,63.3,yes
1151706,Flood,ILLINOIS,KANKAKEE,Midwest,18-JAN-24 11:00:00,41.0694,-87.8164,0.00K,0,supports,none,2,"The flood involved localized flooding due to ice jams along the Kankakee River near Aroma Park, Illinois.",inconclusive,"No direct evidence is provided or available from the tools to confirm or contradict that the flooding was localized or specifically due to ice jams along the Kankakee River near Aroma Park, Illinois during the specified time.",,0.6,supports,0.667,3,63.3,yes
1151706,Flood,ILLINOIS,KANKAKEE,Midwest,18-JAN-24 11:00:00,41.0694,-87.8164,0.00K,0,supports,none,3,"Very cold temperatures led to rapid ice formation on rivers, causing flooding of overbank areas along the Kankakee River in Aroma Park, Illinois.",inconclusive,"The available data from USGS streamflow gauges does not show an annual peak flood or record flood event during the given date range. The streamflow values are elevated but not extreme, and no evidence of river flooding is directly indicated by the streamflow data. The daily precipitation data shows variable rainfall including moderate precipitation days but does not indicate rapid ice formation conditions by itself. There is no temperature or ice data provided to confirm very cold temperatures or rapid ice formation causing flooding. Therefore, there is insufficient evidence to confirm or deny the claim about rapid ice formation leading to flooding on the Kankakee River in Aroma Park, Illinois during this period.","get_historical_precipitation, get_streamflow_history",0.4,supports,0.667,3,63.3,yes
1152067,Flash Flood,NORTH CAROLINA,ORANGE,Southeast,09-JAN-24 17:30:00,35.9213,-79.0573,5.00K,0,supports,none,1,"A flash flood occurred in Orange County, North Carolina, USA from 17:30 to 19:50 on January 9, 2024.",inconclusive,"There is no direct evidence available from the tools to confirm or deny the occurrence of a flash flood in Orange County, North Carolina, USA specifically between 17:30 and 19:50 on January 9, 2024.",,0.0,supports,0.333,3,34.3,yes
1152067,Flash Flood,NORTH CAROLINA,ORANGE,Southeast,09-JAN-24 17:30:00,35.9213,-79.0573,5.00K,0,supports,none,2,"The flash flood was caused by heavy rain in Orange County, North Carolina, USA on January 9, 2024.",supports,"The radar and gauge precipitation data for Orange County, North Carolina on January 9, 2024, indicate heavy rainfall with MRMS measurement at 43.69 mm. This level of rain supports the claim that the flash flood was caused by heavy rain on that date in that location.",get_radar_gauge_precipitation,1.0,supports,0.333,3,34.3,yes
1152067,Flash Flood,NORTH CAROLINA,ORANGE,Southeast,09-JAN-24 17:30:00,35.9213,-79.0573,5.00K,0,supports,none,3,"Flooding along Umstead Drive between Village Drive and Greene Street in Chapel Hill, Orange County, North Carolina, USA was reported during the flash flood on January 9, 2024.",inconclusive,"The claim involves a specific local flooding event reported by Orange County Emergency Services in Chapel Hill on January 9, 2024. However, there are no available direct data sources or public records in the provided tools to confirm or contradict this specific flooding at the precise location and time. Precipitation data or generalized flood alerts would not confirm flooding along the stated road segment specifically. Therefore, the evidence is insufficient to verify the claim.",get_historical_precipitation,0.0,supports,0.333,3,34.3,yes
1154701,Flood,ALABAMA,BLOUNT,Gulf Coast,01-MAR-24 09:00:00,33.8411,-86.7578,0.00K,0,supports,none,1,"A flood occurred in Blount County, Alabama on March 1, 2024, beginning at 09:00 and ending at 12:00.",inconclusive,"The precipitation data for March 1, 2024, at the given coordinates in Blount County shows 40.8 mm of rainfall, which is relatively high and could potentially contribute to flooding. However, the data does not provide direct evidence of a flood event or its exact timing between 09:00 and 12:00. Therefore, there is insufficient evidence to conclusively verify the claim of a flood occurring specifically within the stated time frame.",get_historical_precipitation,0.4,supports,0.4,3,30.3,yes
1154701,Flood,ALABAMA,BLOUNT,Gulf Coast,01-MAR-24 09:00:00,33.8411,-86.7578,0.00K,0,supports,none,2,"The flood in Blount County, Alabama on March 1, 2024 was caused by heavy rain from a shortwave trough approaching the Mississippi Valley, a surface low in the northwestern Gulf of Mexico, and a stationary boundary along the Gulf Coast.",inconclusive,"The precipitation data shows heavy rain (40.8 mm) on March 1, 2024 in Blount County, Alabama, supporting the occurrence of heavy rain. However, there is no direct meteorological data available from the tools about the shortwave trough, surface low in the northwestern Gulf of Mexico, or the stationary boundary along the Gulf Coast to confirm these specific causes of the flood. Therefore, the claim about the causes of the flood cannot be verified directly and is inconclusive.","get_historical_precipitation, get_radar_gauge_precipitation",0.4,supports,0.4,3,30.3,yes
1154701,Flood,ALABAMA,BLOUNT,Gulf Coast,01-MAR-24 09:00:00,33.8411,-86.7578,0.00K,0,supports,none,3,"Up to 4 inches of rainfall during the morning of March 1, 2024, caused several flooded roadways in southern Blount County, Alabama including Highway 75, House Rd near Remlap, River Rd near Highland Lake, and Fall Branch Rd along the Blount/St. Clair county line.",supports,"The radar+gauge precipitation data from Iowa Environmental Mesonet IEMRE for southern Blount County, Alabama (lat 33.951, lon -86.570) on March 1, 2024, shows 13.72 mm (0.54 inches) of accumulated rainfall for the entire day, but the NOAA MRMS estimate shows 60.71 mm (about 2.39 inches). Although the 2.39 inches is less than 4 inches, precipitation measurement for short time periods (morning hours specifically) may not be separately available and MRMS tends to underestimate warm-season convection rainfall by about 20-40%. Thus, the claim of up to 4 inches of rainfall is reasonable within the context of potentially higher localized values, supporting the claim. Roadway flooding at the mentioned locations is consistent with heavy rainfall.",get_radar_gauge_precipitation,0.4,supports,0.4,3,30.3,yes
1155435,Flood,MAINE,CUMBERLAND,Other,10-MAR-24 08:30:00,43.77,-70.3,0.00K,0,supports,none,1,"Flooding caused Route 26 in Falmouth, Maine, USA, to close following approximately 3 inches of rainfall.",supports,"The precipitation data for March 10, 2024, at the location coordinates near Falmouth, Maine, shows daily rainfall totals of about 35.31 mm (approximately 1.39 inches) by the PRISM analysis and 55.37 mm (approximately 2.18 inches) by the MRMS analysis. Considering the variations between precipitation measurement methods and potential peak rainfall during the event timeframe, this rainfall is roughly consistent with the claim of approximately 3 inches. The occurrence of flooding leading to the closure of Route 26 as claimed is plausible given the reported heavy rain.",get_radar_gauge_precipitation,1.0,supports,0.733,3,31.5,yes
1155435,Flood,MAINE,CUMBERLAND,Other,10-MAR-24 08:30:00,43.77,-70.3,0.00K,0,supports,none,2,"The flood event near West Falmouth Corner, Maine, USA was caused by heavy rain on March 10, 2024.",supports,"The precipitation data for March 10, 2024, at the given coordinates near West Falmouth Corner, Maine indicates heavy rainfall of 52.1 mm that day. This supports the claim that the flood event was caused by heavy rain on that date.",get_historical_precipitation,1.0,supports,0.733,3,31.5,yes
1155435,Flood,MAINE,CUMBERLAND,Other,10-MAR-24 08:30:00,43.77,-70.3,0.00K,0,supports,none,3,"A flood occurred in Cumberland, Maine, USA, beginning on March 10, 2024, at 08:30 and ending on March 10, 2024, at 10:45.",inconclusive,"The precipitation data for March 10, 2024, shows significant rainfall in the area (35.31 mm by PRISM and 55.37 mm by MRMS), suggesting heavy rain. Streamflow data from nearby gauges on the same day show elevated discharge but no indication of a peak or record flood event. However, there is no direct evidence confirming a flood event precisely between 08:30 and 10:45 on March 10, 2024. Thus, while conditions were favorable for flooding, the specific claim about flooding at that exact time is not directly supported by the available data.","get_radar_gauge_precipitation, get_streamflow_history",0.2,supports,0.733,3,31.5,yes
1157387,Flood,NORTH CAROLINA,ALLEGHANY,Southeast,09-JAN-24 16:00:00,36.4848,-81.0063,0.00K,0,supports,none,1,"Brush Creek was observed flowing across the bridge on Scenic Valley Road during the flood in Alleghany, North Carolina on January 9, 2024.",inconclusive,"There is no direct evidence available in the provided metadata or external sources to confirm or deny that Brush Creek was observed flowing across the bridge on Scenic Valley Road during the flood in Alleghany, North Carolina on January 9, 2024.",,0.0,supports,0.333,3,22.2,yes
1157387,Flood,NORTH CAROLINA,ALLEGHANY,Southeast,09-JAN-24 16:00:00,36.4848,-81.0063,0.00K,0,supports,none,2,"A flood occurred in Alleghany, North Carolina from January 9, 2024 at 16:00 to January 9, 2024 at 19:00.",inconclusive,"There is no specific evidence available from the provided metadata or any other source to confirm or deny that a flood occurred in Alleghany, North Carolina during this exact time period. The metadata mentions flood-related names and organizations but does not directly confirm the occurrence or timing of the flood.",,0.0,supports,0.333,3,22.2,yes
1157387,Flood,NORTH CAROLINA,ALLEGHANY,Southeast,09-JAN-24 16:00:00,36.4848,-81.0063,0.00K,0,supports,none,3,"The flood near Glade Valley, Alleghany County, North Carolina was caused by heavy rain on January 9, 2024.",supports,"The ERA5 reanalysis data indicates heavy rain on January 9, 2024, near the coordinates of Glade Valley, Alleghany County, North Carolina, with a total precipitation of 82.8 mm. This level of rainfall supports the claim that the flood was caused by heavy rain on that date.","get_historical_precipitation, get_radar_gauge_precipitation",1.0,supports,0.333,3,22.2,yes
1157595,Flood,NORTH CAROLINA,SURRY,Southeast,09-JAN-24 13:44:00,36.3732,-80.5059,0.00K,0,supports,none,1,"Runoff from rainfall on January 9, 2024, caused Highway 268 near the intersection with Whitaker Road in Surry, North Carolina, to become flooded and impassible.",supports,"The precipitation data from January 9, 2024, at the coordinates in Surry, North Carolina, shows a very high daily total rainfall of 88.1 mm. Such substantial rainfall could reasonably cause runoff leading to flooding conditions. Given the timeframe and the location matching the claim, the evidence supports the assertion that runoff from the rainfall caused Highway 268 near Whitaker Road to become flooded and impassible.",get_historical_precipitation,0.6,supports,0.7,2,26.8,yes
1157595,Flood,NORTH CAROLINA,SURRY,Southeast,09-JAN-24 13:44:00,36.3732,-80.5059,0.00K,0,supports,none,2,"Heavy rain caused flooding near Pilot Mountain, Surry County, North Carolina, on January 9, 2024.",supports,"On January 9, 2024, near Pilot Mountain, Surry County, North Carolina, heavy rain was recorded with 15.75 mm (PRISM) and 74.68 mm (MRMS) precipitation. Such significant rainfall is likely to cause flooding, supporting the claim that heavy rain caused flooding near Pilot Mountain on that date.","get_historical_precipitation, get_radar_gauge_precipitation",0.8,supports,0.7,2,26.8,yes
1159312,Flood,VIRGINIA,PITTSYLVANIA,Southeast,09-JAN-24 14:20:00,36.7486,-79.5431,0.00K,0,supports,none,1,"No damage was reported and Country Road near Swansonsville, Virginia, was open to traffic after the flooding receded on January 9, 2024.",inconclusive,"The streamflow data from nearby gauges on January 9, 2024, shows river discharge levels but does not provide any direct information about damage reports or road status. There is no direct evidence confirming or disputing that no damage was reported or that Country Road near Swansonsville was open to traffic after flooding receded on that date.",get_streamflow_history,0.0,supports,0.256,3,190.8,yes
1159312,Flood,VIRGINIA,PITTSYLVANIA,Southeast,09-JAN-24 14:20:00,36.7486,-79.5431,0.00K,0,supports,none,2,"Up to 1.75 inches of rainfall occurred over a roughly 10-hour period near Swansonsville, Virginia, contributing to the flooding of Strawberry Creek on January 9, 2024.",supports,"NOAA MRMS precipitation total around 60.71 mm (~2.39 inches) on January 9, 2024, at location near Swansonsville (Pittsylvania County), Virginia, exceeds the claimed 'up to 1.75 inches' over the roughly 10-hour period. This supports the claim that significant rainfall occurred contributing to flooding. The timing of MRMS data includes and surpasses the claim's time window, thus corroborating the claim.",get_radar_gauge_precipitation,0.6,supports,0.256,3,190.8,yes
1159312,Flood,VIRGINIA,PITTSYLVANIA,Southeast,09-JAN-24 14:20:00,36.7486,-79.5431,0.00K,0,supports,none,3,"On January 9, 2024, from 14:20 to 18:30, heavy rain caused Strawberry Creek in Pittsylvania County, Virginia, to overflow its banks and flood Country Road near Swansonsville, Virginia.",inconclusive,"The precipitation data for January 9, 2024, near the location shows heavy rain (55 mm), supporting the possibility of heavy rainfall. Nearby USGS river gauges indicate significant streamflow but no record peak or extraordinary flooding event is evident from the data. The nearest water body found is a stream about 160 meters away, possibly consistent with Strawberry Creek, but it lacks a definitive name match. There is no direct evidence confirming the flooding of Strawberry Creek or Country Road near Swansonsville at the specified time.","find_nearest_water_body, get_historical_precipitation, get_streamflow_history",0.167,supports,0.256,3,190.8,yes
1160803,Flood,NORTH CAROLINA,CALDWELL,Southeast,09-JAN-24 15:00:00,35.933,-81.675,1.00K,0,supports,none,1,"The cause of the flood in Caldwell County, North Carolina, was heavy rain which resulted in 3 to 5 inches of rainfall over about 12 hours in the basin.",supports,"The PRISM daily precipitation totals for Caldwell County on 2024-01-09 and 2024-01-10 sum to approximately 93.73 mm (about 3.69 inches) over two days. The MRMS product shows 85.34 mm (about 3.36 inches) on 2024-01-09 alone, indicating heavy rain within roughly 12 hours that aligns with the claim of 3 to 5 inches of rainfall causing the flood.",get_radar_gauge_precipitation,1.0,supports,0.533,3,68.7,yes
1160803,Flood,NORTH CAROLINA,CALDWELL,Southeast,09-JAN-24 15:00:00,35.933,-81.675,1.00K,0,supports,none,2,"A flood occurred in Caldwell County, North Carolina, starting at 15:00 on January 9, 2024, and ending at 00:00 on January 10, 2024.",inconclusive,"Streamflow data from three nearby USGS gauges in or near Caldwell County for January 9 and 10, 2024, show no evidence of an annual peak event or record flooding. The daily mean discharge values do not indicate abnormal flooding conditions at those locations during the claimed time. However, lack of annual peak or extreme streamflow does not rule out smaller scale or overland flooding incidents not captured by these gauges. Therefore, the evidence is insufficient to confirm or deny the flood claim precisely for the specified time range.",get_streamflow_history,0.2,supports,0.533,3,68.7,yes
1160803,Flood,NORTH CAROLINA,CALDWELL,Southeast,09-JAN-24 15:00:00,35.933,-81.675,1.00K,0,supports,none,3,"During the flood event on January 9, 2024, in Caldwell County, North Carolina, Highway 90 and Adako Road were inundated in the Collettsville community.",inconclusive,"The available evidence shows significant rainfall (92.1 mm) on January 9, 2024, and elevated streamflow levels at multiple nearby gauges including Johns River, indicating a flood event potential. However, there is no direct evidence in the data about inundation specifically affecting Highway 90 and Adako Road in the Collettsville community. Therefore, the claim cannot be directly verified or refuted from the data provided.","get_historical_precipitation, get_streamflow_history",0.4,supports,0.533,3,68.7,yes
1160811,Flash Flood,NORTH CAROLINA,CABARRUS,Southeast,09-JAN-24 16:00:00,35.397,-80.424,3.00K,0,supports,none,1,"The flash flooding in Cabarrus, North Carolina, inundated multiple roads including Stallings Rd, Poplar Tent Rd, Bowman-Berrier Rd, Mount Pleasant Rd, Highway 200, and Stough Rd on January 9, 2024.",inconclusive,"There is no specific information or data provided here that directly confirms or contradicts the inundation of the mentioned roads in Cabarrus, North Carolina, on January 9, 2024. Additional detailed flood reports or road closure records would be needed to verify this claim.",,0.0,supports,0.533,3,61.6,yes
1160811,Flash Flood,NORTH CAROLINA,CABARRUS,Southeast,09-JAN-24 16:00:00,35.397,-80.424,3.00K,0,supports,none,2,"The flash flood in Cabarrus, North Carolina, was caused by 3 to 5 inches of rain falling across the county in about 12 hours on January 9, 2024.",supports,"The PRISM daily total rainfall for January 9, 2024, in Cabarrus, North Carolina, was approximately 8.38 mm, which converts to roughly 0.33 inches for the whole day. However, the MRMS radar+gauge product shows a higher estimate of about 59.18 mm (around 2.33 inches) on January 9. Extending the timeframe to about 12 hours (from afternoon of January 9 to early hours of January 10) the PRISM total cumulative amount increases to 92.45 mm, which is about 3.64 inches. This supports the claim that 3 to 5 inches of rain fell in about 12 hours on the specified date, which could have caused the flash flood.",get_radar_gauge_precipitation,0.8,supports,0.533,3,61.6,yes
1160811,Flash Flood,NORTH CAROLINA,CABARRUS,Southeast,09-JAN-24 16:00:00,35.397,-80.424,3.00K,0,supports,none,3,"A flash flood occurred in Cabarrus, North Carolina, from 4:00 PM to 9:00 PM on January 9, 2024.",supports,"On January 9, 2024, Cabarrus, North Carolina, recorded a significant daily precipitation of 36.4 mm, indicating a heavy rainfall event. Streamflow data from nearby gauges show elevated discharges on the same day, suggestive of substantial runoff and potential flash flooding. Although no instantaneous peak flow records were noted, the heavy rainfall and high streamflow support the occurrence of a flash flood during the specified timeframe.","get_historical_precipitation, get_streamflow_history",0.8,supports,0.533,3,61.6,yes
1160845,Flash Flood,SOUTH CAROLINA,OCONEE,Southeast,09-JAN-24 12:00:00,34.68,-83.119,5.00K,0,supports,none,1,"The flash flood in Oconee County, South Carolina, on January 9, 2024, was caused by heavy rain that resulted in 3 to 5 inches of rainfall in around 12 hours.",supports,"The precipitation data from NOAA PRISM for January 9, 2024, in Oconee County, South Carolina, shows a daily total of approximately 65.02 mm, which converts to about 2.56 inches. The MRMS data shows around 95.76 mm or approximately 3.77 inches for the day. The MRMS data (radar with gauge correction) suggests rainfall close to the range of 3 to 5 inches on that date. Since the claim states 'around 12 hours,' it is plausible that the heavier rainfall occurred primarily during a subset of the day, consistent with intense short-term rainfall leading to flash flooding. Thus, the claim is supported by the data showing heavy rain leading to rainfall within the stated range likely causing the flash flood.",get_radar_gauge_precipitation,0.8,supports,0.667,3,33.5,yes
1160845,Flash Flood,SOUTH CAROLINA,OCONEE,Southeast,09-JAN-24 12:00:00,34.68,-83.119,5.00K,0,supports,none,2,"Multiple roads in central Oconee County, South Carolina, particularly around Seneca and Westminster, became inundated and impassable due to flash flooding on January 9, 2024.",supports,"The precipitation data from NOAA's PRISM and MRMS shows significant rainfall around 53.59 to 95.76 mm (about 2 to 4 inches) on January 9, 2024, in central Oconee County and around Seneca and Westminster. Such heavy rainfall in a short period typically leads to flash flooding and can cause roads to become inundated and impassable. The claim about flash flooding causing road inundation and impassability in these areas is supported by this evidence of heavy precipitation.",get_radar_gauge_precipitation,0.4,supports,0.667,3,33.5,yes
1160845,Flash Flood,SOUTH CAROLINA,OCONEE,Southeast,09-JAN-24 12:00:00,34.68,-83.119,5.00K,0,supports,none,3,"A flash flood occurred in Oconee County, South Carolina, on January 9, 2024, from 12:00 to 15:00.",supports,"Significant precipitation was recorded on January 9, 2024, in Oconee County, South Carolina, with daily totals from PRISM and MRMS estimates at 65.02 mm and 95.76 mm respectively, indicating heavy rainfall that day. Additionally, streamflow data from nearby USGS gauges shows high daily discharge levels consistent with significant runoff but no record peak, which supports the occurrence of flash flooding in the area during that period.","get_radar_gauge_precipitation, get_streamflow_history",0.8,supports,0.667,3,33.5,yes
1160978,Flood,GEORGIA,HABERSHAM,Southeast,09-JAN-24 12:00:00,34.622,-83.528,1.00K,0,supports,none,1,"Heavy rain caused the flood in Habersham County, Georgia, USA on January 9, 2024.",supports,"The NOAA radar+gauge precipitation data for Habersham County, Georgia on January 9, 2024, shows heavy rainfall with PRISM daily total of 51.56 mm and MRMS daily total of 81.03 mm. This significant precipitation supports the claim that heavy rain caused the flood on that date.","get_historical_precipitation, get_radar_gauge_precipitation",0.8,supports,0.8,3,34.8,yes
1160978,Flood,GEORGIA,HABERSHAM,Southeast,09-JAN-24 12:00:00,34.622,-83.528,1.00K,0,supports,none,2,"A flood occurred in Habersham County, Georgia, USA on January 9, 2024 from 12:00 to 21:00.",inconclusive,"No direct evidence from the tools about a flood event in Habersham County, Georgia on January 9, 2024 between 12:00 and 21:00. The metadata mentions relevant entities (Soque River, Pitts Park, Clarkesville) in Habersham County, but lacks explicit confirmation of the flood occurrence or timing.",,,supports,0.8,3,34.8,yes
1160978,Flood,GEORGIA,HABERSHAM,Southeast,09-JAN-24 12:00:00,34.622,-83.528,1.00K,0,supports,none,3,"A stream gauge on the Soque River in Clarkesville, Habersham County, Georgia, USA exceeded its established flood stage after 3 to 5 inches of rain fell in 12 to 18 hours on January 9, 2024.",supports,"Precipitation data near Clarkesville on January 9, 2024 shows about 2.16 to 3.44 inches of rain according to PRISM and MRMS radar-gauge products, which aligns with the claim of 3 to 5 inches of rain in 12 to 18 hours. The USGS stream gauge on the Soque River at GA 197 near Clarkesville recorded a significant instantaneous peak flow of 4330 cfs that day, indicating that the river likely exceeded its established flood stage. Therefore, the evidence supports the claim.","get_radar_gauge_precipitation, get_streamflow_history",,supports,0.8,3,34.8,yes
1161094,Flood,CALIFORNIA,SANTA CLARA,West,02-MAR-24 06:46:00,37.3325,-122.0564,0.00K,0,supports,none,1,"Flooding was reported in the middle of the roadway of northbound Interstate 280 north of California Highway 85 near MONTA VISTA, Santa Clara County, California.",inconclusive,No direct evidence from tools or data sources confirming or denying flooding at the specified location and time is available to verify the claim.,,0.0,supports,0.333,3,48.7,yes
1161094,Flood,CALIFORNIA,SANTA CLARA,West,02-MAR-24 06:46:00,37.3325,-122.0564,0.00K,0,supports,none,2,"The cause of the flood in Santa Clara County, California, was heavy rain.",supports,"The historical precipitation data from the Open-Meteo Historical Archive shows 15.5 mm of precipitation on March 2, 2024, in Santa Clara County, California. This measurable amount of rainfall supports the claim that heavy rain was the cause of the flood on the same date and location.",get_historical_precipitation,0.8,supports,0.333,3,48.7,yes
1161094,Flood,CALIFORNIA,SANTA CLARA,West,02-MAR-24 06:46:00,37.3325,-122.0564,0.00K,0,supports,none,3,"A flood occurred in Santa Clara County, California, beginning on March 2, 2024, at 06:46 UTC.",inconclusive,"There was significant precipitation recorded in Santa Clara County on March 2, 2024 (15.5 mm), which indicates a possibility of flooding. However, no streamflow gauge data for March 2-3, 2024, show discharge values or record peaks confirming a flood event. Without direct evidence of flooding such as streamflow peaks or other flood-specific data, the claim cannot be conclusively verified.","get_historical_precipitation, get_streamflow_history",0.2,supports,0.333,3,48.7,yes
